状态	地区	学校标识码	学校名称	主管部门	所在地	办学层次	备注	adminType	categoryName	英文名称	双一流建设	官网链接	更新说明
1	重庆市	4150014315	重庆化工职业学院	重庆市	重庆市	专科		地方公办	理工	Chongqing Chemical Industry Vocational College		http://www.cqhgzy.com/	
1	重庆市	4150014316	重庆旅游职业学院	重庆市	重庆市	专科		地方公办	财经	Chongqing Vocational Institute Of Tourism		http://www.cqvit.com	
1	重庆市	4150014365	重庆安全技术职业学院	重庆市	重庆市	专科		地方公办	理工	Chongqing Vocational Insitute Of Safety & Technology		http://www.cqvist.net	
1	重庆市	4150014366	重庆公共运输职业学院	重庆市教委	重庆市	专科	民办	民办高校	理工	Chongqing Vocational College Of Public Transportation		http://www.cqgyzy.com/	
1	重庆市	4150014367	重庆艺术工程职业学院	重庆市教委	重庆市	专科	民办	民办高校	文艺	Chongqing Vocational College Of Art And Engineering		http://www.cqysxy.com/	
1	重庆市	4150014368	重庆轻工职业学院	重庆市教委	重庆市	专科	民办	民办高校	理工	Chongqing Vocational College Of Light Industry		http://www.cqivc.com	
1	重庆市	4150014369	重庆电信职业学院	重庆市教委	重庆市	专科	民办	民办高校	理工	Chongqing Electronic Information College		http://www.cqtcedu.com/	
1	重庆市	4150014370	重庆经贸职业学院	重庆市教委	重庆市	专科	民办	民办高校	财经	Chongqing Vocational College Of Economics And Trade		http://www.cqvcet.com	
1	重庆市	4150014388	重庆第二师范学院	重庆市	重庆市	本科		地方公办	师范	Chongqing University of Education		http://www.cque.edu.cn/	
1	重庆市	4150014428	重庆幼儿师范高等专科学校	重庆市	重庆市	专科		地方公办	师范	Chongqing Preschool Education College		http://www.cqpec.com	
1	重庆市	4150014482	重庆文化艺术职业学院	重庆市	重庆市	专科		地方公办	文艺	Chongqing Vocational College Of Culture And Arts		http://www.cqyixiao.com/	
1	重庆市	4150014491	重庆科技职业学院	重庆市教委	重庆市	专科	民办	民办高校	理工	Chongqing Vocational College Of Science And Technology		http://www.cqkjzyxy.com/	
1	重庆市	4150014557	重庆资源与环境保护职业学院	重庆市教委	重庆市	专科	民办	民办高校	理工	Chongqing Recourses And Environmental Protection Of University		http://www.cqzhxy.cn	
1	重庆市	4150014576	重庆护理职业学院	重庆市教委	重庆市	专科	民办	民办高校	医药	Chongqing Nursing Vocational College		http://www.cqnvc.com/	
1	重庆市	4150014725	重庆理工职业学院	重庆市教委	重庆市	专科	民办	民办高校	理工	Chongqing Polytechnic Institute		http://www.cqip.com.cn/	学校名称：2019->2020年 新增“重庆理工职业学院”（重庆市教育厅）
1	重庆市	4150014726	重庆智能工程职业学院	重庆市教委	重庆市	专科	民办	民办高校	理工	Chongqing Vocational College Of Intelligent Engineering		https://www.cqai.vip/	学校名称：2019->2020年 新增“重庆智能工程职业学院”（重庆市教育厅）
1	重庆市	4150014727	重庆健康职业学院	重庆市教委	重庆市	专科	民办	民办高校	医药	Chongqing Health College		http://www.cqhve.cn/	学校名称：2019->2020年 新增“重庆健康职业学院”（重庆市教育厅）
1	重庆市	4150014766	重庆工信职业学院	重庆市	重庆市	专科		地方公办	综合	Chongqing Industry And Information Vocational College		http://www.cqiivc.com	学校名称：2020->2021年 新增“重庆工信职业学院”
1	重庆市	4150014776	重庆五一职业技术学院	重庆市	重庆市	专科		地方公办	综合	Chongqing Wuyi Polytechinc College		http://www.cq51.cn	学校名称：2021->2022年 新增“重庆五一职业技术学院”
1	重庆市	4150014830	重庆中医药学院	重庆市	重庆市	本科		地方公办	医药	Chongqing College of Traditional Chinese Medicine		https://www.cqctcm.edu.cn/	学校名称：2022->2023年 新增“重庆中医药学院”
1	重庆市	4150014838	重庆数字产业职业技术学院	重庆市教委	重庆市	专科	民办	民办高校	综合	Chongqing Digital Industry Polytechnic College			学校名称：2023->2024年 新增“重庆数字产业职业技术学院”
1	重庆市	4150014870	重庆现代制造职业学院	重庆市教委	重庆市	专科	民办	民办高校	理工	Chongqing Vocational College of Modern Manufacturing			学校名称：2023->2024年 新增“重庆现代制造职业学院”
1	四川省	4111012802	吉利学院	四川省教育厅	成都市	本科	民办	民办高校	综合	Beijing Geely University		http://www.bgu.edu.cn/	学校名称：2019->2020年 “北京吉利学院”更名为“吉利学院”；主管部门：2019->2020年 “北京市教委”更改为“四川省教育厅”；所在地：2019->2020年 “北京市”更改为“成都市”，2020->2021年 “成都市”更改为“四川省”，2021->2022年 “四川省”更改为“成都市”
1	四川省	4151010610	四川大学	教育部	成都市	本科		教育部直属	综合	Sichuan University	211，985，双一流	https://www.scu.edu.cn/	
1	四川省	4151010613	西南交通大学	教育部	成都市	本科		教育部直属	理工	Southwest Jiaotong University	211，双一流	https://www.swjtu.edu.cn/	
1	四川省	4151010614	电子科技大学	教育部	成都市	本科		教育部直属	理工	University of Electronic Science and Technology of China	211，985，双一流	https://www.uestc.edu.cn/	
1	四川省	4151010615	西南石油大学	四川省	成都市	本科		地方公办	理工	Southwest Petroleum University	双一流	https://www.swpu.edu.cn/	
1	四川省	4151010616	成都理工大学	四川省	成都市	本科		地方公办	理工	Chengdu University of Technology	双一流	https://www.cdut.edu.cn/	
1	四川省	4151010619	西南科技大学	四川省	绵阳市	本科		地方公办	理工	Southwest University of Science and Technology		http://www.swust.edu.cn/	
1	四川省	4151010621	成都信息工程大学	四川省	成都市	本科		地方公办	理工	Chengdu University of Information Technology		https://www.cuit.edu.cn/	
1	四川省	4151010622	四川轻化工大学	四川省	自贡市	本科		地方公办	理工	Sichuan University of Science and Engineering		http://www.suse.edu.cn/	学校名称：2017->2019年 “四川理工学院”更名为“四川轻化工大学”
1	四川省	4151010623	西华大学	四川省	成都市	本科		地方公办	综合	Xihua University		http://www.xhu.edu.cn/	
1	四川省	4151010624	中国民用航空飞行学院	交通运输部（中国民用航空局）	德阳市	本科		中央部属	理工	Civil Aviation Flight University of China		http://www.cafuc.edu.cn/	
1	四川省	4151010626	四川农业大学	四川省	雅安市	本科		地方公办	农业	Sichuan Agricultural University	211，双一流	https://www.sicau.edu.cn/	
1	四川省	4151010628	西昌学院	四川省	凉山彝族自治州	本科		地方公办	综合	Xichang College		http://www.xcc.sc.cn/	
1	四川省	4151010632	西南医科大学	四川省	泸州市	本科		地方公办	医药	Southwest Medical University		http://www.lzmc.edu.cn/	
1	四川省	4151010633	成都中医药大学	四川省	成都市	本科		地方公办	医药	Chengdu University of Traditional Chinese Medicine	双一流	https://www.cdutcm.edu.cn/	
1	四川省	4151010634	川北医学院	四川省	南充市	本科		地方公办	医药	North Sichuan Medical College		http://www.nsmc.edu.cn/	
1	四川省	4151010636	四川师范大学	四川省	成都市	本科		地方公办	师范	Sichuan Normal University		https://www.sicnu.edu.cn/	
1	四川省	4151010638	西华师范大学	四川省	南充市	本科		地方公办	师范	China West Normal University		http://www.cwnu.edu.cn/	
1	四川省	4151010639	绵阳师范学院	四川省	绵阳市	本科		地方公办	师范	Mianyang Teachers' College		http://www.mnu.cn	
1	四川省	4151010640	内江师范学院	四川省	内江市	本科		地方公办	师范	Neijiang Normal University		http://www.njtc.edu.cn/	
1	四川省	4151010641	宜宾学院	四川省	宜宾市	本科		地方公办	综合	Yibin University		http://www.yibinu.cn/web/	
1	四川省	4151010644	四川文理学院	四川省	达州市	本科		地方公办	综合	Sichuan University of Arts and Science		http://www.sasu.cn/	
1	四川省	4151010646	阿坝师范学院	四川省	阿坝藏族羌族自治州	本科		地方公办	师范	A BA Teachers University		http://www.abtu.edu.cn/	
1	四川省	4151010649	乐山师范学院	四川省	乐山市	本科		地方公办	师范	Leshan Normal University		http://www.lstc.edu.cn/	
1	四川省	4151010651	西南财经大学	教育部	成都市	本科		教育部直属	财经	Southwestern University of Finance and Economics	211，双一流	https://www.swufe.edu.cn/	
1	四川省	4151010653	成都体育学院	四川省	成都市	本科		地方公办	体育	Chengdu Sport University		https://www.cdsu.edu.cn/	
1	四川省	4151010654	四川音乐学院	四川省	成都市	本科		地方公办	艺术	Sichuan Conservatory of Music		http://www.sccm.cn	
1	四川省	4151010656	西南民族大学	国家民委	成都市	本科		中央部属	民族	Southwest Minzu University		https://www.swun.edu.cn/	
1	四川省	4151011079	成都大学	四川省	成都市	本科		地方公办	综合	Chengdu University		http://www.cdu.edu.cn/	学校名称：2017->2019年 “成都学院”更名为“成都大学”
1	四川省	4151011116	成都工业学院	四川省	成都市	本科		地方公办	理工	Chengdu Technological University		http://www.cdtu.edu.cn/	
1	四川省	4151011360	攀枝花学院	四川省	攀枝花市	本科		地方公办	综合	Panzhihua University		http://www.pzhu.cn	
1	四川省	4151011552	四川旅游学院	四川省	成都市	本科		地方公办	综合	Sichuan Tourism University		https://www.sctu.edu.cn/	
1	四川省	4151011553	成都纺织高等专科学校	四川省	成都市	专科		地方公办	理工	Chengdu Textile College		http://www.cdtc.edu.cn/	
1	四川省	4151011661	四川民族学院	四川省	甘孜藏族自治州	本科		地方公办	师范	Sichuan University for Nationalities		http://www.scun.edu.cn/	
1	四川省	4151011841	民办四川天一学院	四川省教育厅	成都市	专科	民办	民办高校	综合	Sichuan Tianyi College		http://www.tianyi.edu.cn/	
1	四川省	4151012064	成都航空职业技术学院	四川省	成都市	专科		地方公办	理工	Chengdu Aeronautic Polytechnic		http://www.cap.edu.cn/	
1	四川省	4151012065	四川电力职业技术学院	四川省	成都市	专科		地方公办	理工	Sichuan Electric Vocational And Technical College		https://www.scdy.edu.cn/	
1	四川省	4151012212	四川警察学院	四川省	泸州市	本科		地方公办	政法	Sichuan Police College		http://www.scpolicec.com/	
1	四川省	4151012635	成都职业技术学院	四川省	成都市	专科		地方公办	综合	Chengdu Polytechnic		http://www.cdp.edu.cn/	
1	四川省	4151012636	成都东软学院	四川省教育厅	成都市	本科	民办	民办高校	理工	Chengdu Neusoft University		http://www.nsu.edu.cn/	
1	四川省	4151012637	四川化工职业技术学院	四川省	泸州市	专科		地方公办	理工	Sichuan Vocational College Of Chemical Technology		http://zjc.sccc.edu.cn/	
1	四川省	4151012638	四川水利职业技术学院	四川省	成都市	专科		地方公办	理工	Sichuan Water Conservancy Vocational College		http://www.swcvc.net.cn	
1	四川省	4151012639	南充职业技术学院	四川省	南充市	专科		地方公办	综合	Nanchong Vocational And Technical College		http://www.nczy.com	
1	四川省	4151012640	内江职业技术学院	四川省	内江市	专科		地方公办	综合	Neijiang Vocational&Technical College		http://www.njvtc.cn	
1	四川省	4151012641	四川航天职业技术学院	四川省	成都市	专科		地方公办	理工	Sichuan Aerospace Vocational College		http://www.sacvt.com	
1	四川省	4151012642	四川邮电职业技术学院	四川省	成都市	专科		地方公办	理工	Sichuan Post And Telecommunication College		http://www.sptpc.com	
1	四川省	4151012751	四川机电职业技术学院	四川省	攀枝花市	专科		地方公办	理工	Sichuan Electromechanical Institute Of Vocation And Technology		http://www.scemi.com	
1	四川省	4151012753	绵阳职业技术学院	四川省	绵阳市	专科		地方公办	综合	Mianyang Polytechnic		http://www.myvtc.edu.cn/	
1	四川省	4151012761	四川交通职业技术学院	四川省	成都市	专科		地方公办	理工	Sichuan Vocational And Technical College Of Communications		http://www.svtcc.edu.cn/	
1	四川省	4151012762	四川工商职业技术学院	四川省	成都市	专科		地方公办	理工	Sichuan Technology & Business College		http://www.sctbc.net/	
1	四川省	4151012763	四川工程职业技术大学	四川省	德阳市	本科		地方公办	理工	Sichuan Engineering Technical College		http://www.scetc.net/	学校名称：2023->2024年 “四川工程职业技术学院”更名为“四川工程职业技术大学”；办学层次：2023->2024年 “专科”更改为“本科”
1	四川省	4151012764	四川建筑职业技术学院	四川省	德阳市	专科		地方公办	理工	Sichuan College Of Architectural Technology		http://www.scatc.net/	
1	四川省	4151012767	达州职业技术学院	四川省	达州市	专科		地方公办	综合	Dazhou Vocational And Technial College		http://www.dzvtc.edu.cn/	
1	四川省	4151012963	四川托普信息技术职业学院	四川省教育厅	成都市	专科	民办	民办高校	理工	Sichuan Top It Vocational Institute		http://www.scetop.com/	
1	四川省	4151012964	四川国际标榜职业学院	四川省教育厅	成都市	专科	民办	民办高校	文艺	Polus International College		http://www.polus.edu.cn/	
1	四川省	4151012965	成都农业科技职业学院	四川省	成都市	专科		地方公办	农林	Chengdu Agricultural College		http://www.cdnkxy.edu.cn/	
1	四川省	4151012966	宜宾职业技术学院	四川省	宜宾市	专科		地方公办	综合	Yibin Vocational And Technical College		http://www.ybzy.cn/	
1	四川省	4151012967	泸州职业技术学院	四川省	泸州市	专科		地方公办	综合	Luzhou Vocational And Technical College		http://www.lzy.edu.cn	
1	四川省	4151012968	眉山职业技术学院	四川省	眉山市	专科		地方公办	综合	Meishan Vocational And Technical College		http://www.msvtc.net/	
1	四川省	4151012969	成都艺术职业大学	四川省教育厅	成都市	本科	民办	民办高校	艺术	Chengdu Vocational University of the Art		https://www.cdau.edu.cn/	学校名称：2017->2019年 “成都艺术职业学院”更名为“成都艺术职业大学”；办学层次：2017->2019年 “专科”更改为“本科”
1	四川省	4151012970	四川职业技术学院	四川省	遂宁市	专科		地方公办	综合	Sichuan Vocational And Technical College		http://www.sczyxy.cn/	
1	四川省	4151013048	乐山职业技术学院	四川省	乐山市	专科		地方公办	综合	Leshan Vocational And Technical College		http://www.lszyxy.com/	
1	四川省	4151013049	雅安职业技术学院	四川省	雅安市	专科		地方公办	综合	Ya'An Polytechnic College		http://www.yazjy.com	
1	四川省	4151013665	电子科技大学成都学院	四川省教育厅	成都市	本科	民办	独立学院	理工	Chengdu college Of University Of Electronic Science And Technology of china		http://www.cduestc.cn/	
1	四川省	4151013668	成都理工大学工程技术学院	四川省教育厅	乐山市	本科	民办	独立学院	理工	The Engineering and Technical College of Chengdu University of Technology		http://www.cdutetc.cn	
1	四川省	4151013669	四川传媒学院	四川省教育厅	成都市	本科	民办	民办高校	艺术	Sichuan University of Media and Communications		http://www.scmc.edu.cn/	
1	四川省	4151013670	成都银杏酒店管理学院	四川省教育厅	成都市	本科	民办	民办高校	财经	Gingko College of Hospitality Management		http://www.gingkoc.edu.cn/	学校名称：2019->2020年 “成都信息工程大学银杏酒店管理学院”更名为“成都银杏酒店管理学院”
1	四川省	4151013671	成都文理学院	四川省教育厅	成都市	本科	民办	民办高校	师范	Chengdu College of Arts and Sciences		http://www.cdcas.edu.cn/	
1	四川省	4151013672	四川工商学院	四川省教育厅	成都市	本科	民办	民办高校	综合	Sichuan Technology and Business University		http://www.stbu.edu.cn/	
1	四川省	4151013673	成都外国语学院	四川省教育厅	成都市	本科	民办	民办高校	语言				学校名称：2023->2024年 “四川外国语大学成都学院”更名为“成都外国语学院”
1	四川省	4151013705	成都医学院	四川省	成都市	本科		地方公办	医药	Chengdu Medical College		https://www.cmc.edu.cn/	
1	四川省	4151013812	四川商务职业学院	四川省	成都市	专科		地方公办	财经	Sichuan Business Vocational College		http://www.scsw.net.cn	
1	四川省	4151013813	四川司法警官职业学院	四川省	德阳市	专科		地方公办	政法	Sichuan Judicial And Police Officers Professional College		http://www.sjpopc.net	
1	四川省	4151013814	广安职业技术学院	四川省	广安市	专科		地方公办	综合	Guang'An Vocational Technical College		http://www.gavtc.cn/	
1	四川省	4151013815	四川信息职业技术学院	四川省	广元市	专科		地方公办	理工	Sichuan Information Technology College		http://www.scitc.com.cn/	
1	四川省	4151013816	四川工业科技学院	四川省教育厅	德阳市	本科	民办	民办高校	综合	Sichuan Institute of Industrial Technology		http://www.scimvc.cn/	
1	四川省	4151013903	成都锦城学院	四川省教育厅	成都市	本科	民办	民办高校	综合			https://www.cdjcc.edu.cn/	学校名称：2020->2021年 “四川大学锦城学院”更名为“成都锦城学院”
1	四川省	4151014004	四川文化传媒职业学院	四川省教育厅	成都市	专科	民办	民办高校	文艺	Sichuan Vocational College Of Culture & Communication		http://www.svccc.net	
1	四川省	4151014005	四川华新现代职业学院	四川省教育厅	成都市	专科	民办	民办高校	综合	Sichuan Huaxin Modern Vocational College		http://www.schxmvc.com.cn/	
1	四川省	4151014006	四川铁道职业学院	四川省	成都市	专科		地方公办	理工	Sichuan Railway College		https://www.scrc.edu.cn/	学校名称：2017->2019年 “四川管理职业学院”更名为“四川铁道职业学院”
1	四川省	4151014007	四川艺术职业学院	四川省	成都市	专科		地方公办	文艺	Sichuan Vocational College Of Art		http://www.scapi.cn	
1	四川省	4151014010	四川中医药高等专科学校	四川省	绵阳市	专科		地方公办	医药	Sichuan College Of Traditional Chinese Medicine		http://www.scctcm.cn	
1	四川省	4151014037	西南财经大学天府学院	四川省教育厅	绵阳市	本科	民办	独立学院	财经	Tianfu College of Swufe		http://www.tfswufe.edu.cn/	
1	四川省	4151014039	四川大学锦江学院	四川省教育厅	眉山市	本科	民办	独立学院	综合	Sichuan University Jinjiang College		http://www.scujjedu.cn/	
1	四川省	4151014043	四川文化艺术学院	四川省教育厅	绵阳市	本科	民办	民办高校	艺术	Sichuan College of Culture and Arts		http://www.cymy.edu.cn/	
1	四川省	4151014045	绵阳城市学院	四川省教育厅	绵阳市	本科	民办	民办高校	理工	Yunnan Normal University Business School		http://www.mycc.edu.cn/	学校名称：2020->2021年 “西南科技大学城市学院”更名为“绵阳城市学院”
1	四川省	4151014070	四川科技职业学院	四川省教育厅	成都市	专科	民办	民办高校	理工	Sichuan University Of Science And Technology		http://www.scstc.cn	
1	四川省	4151014086	四川文化产业职业学院	四川省	成都市	专科		地方公办	文艺	Sichuan Vocational College Of Cultural Industries		http://www.scvcci.cn/	
1	四川省	4151014091	四川财经职业学院	四川省	成都市	专科		地方公办	财经	Sichuan Vocational College Of Finance And Economics		http://www.scpcfe.cn	
1	四川省	4151014175	四川城市职业学院	四川省教育厅	成都市	专科	民办	民办高校	综合	Urban Vocational College Of Sichuan		http://www.scuvc.com/	
1	四川省	4151014176	四川现代职业学院	四川省教育厅	成都市	专科	民办	民办高校	理工	Sichuan Modern Vocational College		http://www.scmvc.cn/	
1	四川省	4151014221	四川幼儿师范高等专科学校	四川省	绵阳市	专科		地方公办	师范	Sichuan Preschool Educators College		http://www.scyesz.edu.cn/	
1	四川省	4151014262	西南交通大学希望学院	四川省教育厅	南充市	本科	民办	独立学院	综合	Southwest Jiaotong University Hope College		http://www.swjtuhc.cn/	
1	四川省	4151014323	四川长江职业学院	四川省教育厅	成都市	专科	民办	民办高校	综合	Sichuan Changjiang Vocational College		http://www.sccvc.com/	
1	四川省	4151014386	四川三河职业学院	四川省教育厅	泸州市	专科	民办	民办高校	综合	Sichuan Sanhe College Of Professionals		http://www.scshpc.com/	
1	四川省	4151014389	成都师范学院	四川省	成都市	本科		地方公办	师范	Chengdu Normal University		http://www.cdnu.edu.cn/	
1	四川省	4151014393	川北幼儿师范高等专科学校	四川省	广元市	专科		地方公办	师范	North Sichuan College Of Preschool Teacher Education		http://www.cbyzsc.cn/	
1	四川省	4151014409	四川卫生康复职业学院	四川省	自贡市	专科		地方公办	医药	Sichuan Vocational College Of Health And Rehabilitation		http://www.svchr.edu.cn/	
1	四川省	4151014410	四川电影电视学院	四川省教育厅	成都市	本科	民办	民办高校	艺术	Sichuan Film and Television College		https://www.sfc.edu.cn/	
1	四川省	4151014411	四川汽车职业技术学院	四川省教育厅	绵阳市	专科	民办	民办高校	理工	Sichuan Automotive Vocational And Technical College		http://www.scavtc.com/	
1	四川省	4151014483	巴中职业技术学院	四川省教育厅	巴中市	专科	民办	民办高校	综合	Bazhong Vocational And Technical College		https://www.bzzyjsxy.cn/	
1	四川省	4151014484	四川希望汽车职业学院	四川省教育厅	资阳市	专科	民办	民办高校	理工	Sichuan Hope Automobile Vocational College		http://qicheedu.com/	
1	四川省	4151014485	四川电子机械职业技术学院	四川省教育厅	绵阳市	专科	民办	民办高校	理工	Sichuan Elictronic Machinery Vocationai And Technical College		http://www.scemvtc.com	
1	四川省	4151014486	四川文轩职业学院	四川省教育厅	成都市	专科	民办	民办高校	综合	Sichuan Winshare Vocational College		http://www.scwxzyxy.cn/	
1	四川省	4151014496	川南幼儿师范高等专科学校	四川省	内江市	专科		地方公办	师范	South Sichuan Preschool Education College		http://www.cnyz.edu.cn/	
1	四川省	4151014513	四川护理职业学院	四川省	德阳市	专科		地方公办	医药	Sichuan Nursing Vocational College		http://www.cnsnvc.com/	
1	四川省	4151014514	成都工业职业技术学院	四川省	成都市	专科		地方公办	理工	Chengdu Vocational& Technical College Of Industry		http://www.cdivtc.com.cn/	
1	四川省	4151014515	四川西南航空职业学院	四川省教育厅	成都市	专科	民办	民办高校	理工	Sichuan Southwest Vocational College Of Civil Aviation		http://www.xnhkxy.edu.cn/	
1	四川省	4151014547	成都工贸职业技术学院	四川省	成都市	专科		地方公办	综合	Chengdu Industry And Trade College		http://www.cdgmxy.com	
1	四川省	4151014548	四川应用技术职业学院	四川省教育厅	凉山彝族自治州	专科	民办	民办高校	综合	Sichuan College Of Applied Sciences		https://www.scasc.cn/	
1	四川省	4151014629	西昌民族幼儿师范高等专科学校	四川省	凉山彝族自治州	专科		地方公办	师范	Xichang Minzu Preschool Normal College		http://www.xcmzyz.com/	学校名称：2017->2019年 新增“西昌民族幼儿师范高等专科学校”
1	四川省	4151014640	眉山药科职业学院	四川省教育厅	眉山市	专科	民办	民办高校	医药	Meishan Pharmaceutical College		https://www.msykxy.cn/	学校名称：2017->2019年 新增“眉山药科职业学院”
1	四川省	4151014641	天府新区信息职业学院	四川省教育厅	眉山市	专科	民办	民办高校	综合	Tianfu Information Vocational College		http://www.tficedu.com/	学校名称：2017->2019年 新增“天府新区信息职业学院”
1	四川省	4151014642	德阳城市轨道交通职业学院	四川省教育厅	德阳市	专科	民办	民办高校	理工	Deyang College Of Urban Rail Transit		http://www.dcurt.cn/	学校名称：2017->2019年 新增“德阳城市轨道交通职业学院”
1	四川省	4151014643	德阳科贸职业学院	四川省教育厅	德阳市	专科	民办	民办高校	财经	Deyang Vocational College Of Technology And Trade		https://www.dyvctt.edu.cn/	学校名称：2017->2019年 新增“德阳科贸职业学院”
1	四川省	4151014644	江阳城建职业学院	四川省教育厅	泸州市	专科	民办	民办高校	理工	Jiangyang City Construction College		http://www.jyccc.cn/	学校名称：2017->2019年 新增“江阳城建职业学院”
1	四川省	4151014645	天府新区航空旅游职业学院	四川省教育厅	眉山市	专科	民办	民办高校	财经	Tianfu New Area Aviation & Tourism College		http://www.tfhk.edu.cn/	学校名称：2017->2019年 新增“天府新区航空旅游职业学院”
