状态	地区	学校标识码	学校名称	主管部门	所在地	办学层次	备注	adminType	categoryName	英文名称	双一流建设	官网链接	更新说明
1	河南省	4141014040	郑州商学院	河南省教育厅	郑州市	本科	民办	民办高校	财经	Zhengzhou Business University		http://www.zbu.edu.cn/	学校名称：2017->2019年 “郑州成功财经学院”更名为“郑州商学院”
1	河南省	4141014062	郑州电力职业技术学院	河南省教育厅	郑州市	专科	民办	民办高校	理工	Zhengzhou Electric Power Technology College		http://www.zzdl.com	
1	河南省	4141014169	河南科技职业大学	河南省教育厅	周口市	本科	民办	民办高校	理工	Henan Vocational University of Science and Technology		https://www.havust.edu.cn/	学校名称：2017->2019年 “周口科技职业学院”更名为“河南科技职业大学”；办学层次：2017->2019年 “专科”更改为“本科”
1	河南省	4141014181	河南建筑职业技术学院	河南省	郑州市	专科		地方公办	理工	Henan Technical College Of Construction		http://www.hnjs.com.cn/	
1	河南省	4141014233	漯河食品工程职业大学	河南省教育厅	漯河市	本科	民办	民办高校	综合	Luohe Vocationl College Of Food			学校名称：2023->2024年 “漯河食品职业学院”更名为“漯河食品工程职业大学”；办学层次：2023->2024年 “专科”更改为“本科”
1	河南省	4141014235	郑州城市职业学院	河南省教育厅	郑州市	专科	民办	民办高校	综合	City University Of Zhengzhou		http://www.brenda.edu.cn/	
1	河南省	4141014243	安阳职业技术学院	河南省	安阳市	专科		地方公办	理工	Anyang Vocational And Technical College		http://www.ayzy.cn	
1	河南省	4141014245	新乡职业技术学院	河南省	新乡市	专科		地方公办	理工	Xinxiang Vocational And Technical College		http://www.xxvtc.com/	
1	河南省	4141014251	驻马店职业技术学院	河南省	驻马店市	专科		地方公办	理工	Zhumadian Vocational And Technical College		http://www.zmdvtc.cn/	
1	河南省	4141014300	焦作工贸职业学院	河南省教育厅	焦作市	专科	民办	民办高校	理工	Jiaozuo College Of Industry And Trade		http://www.jzgmxy.com/	
1	河南省	4141014301	许昌陶瓷职业学院	河南省教育厅	许昌市	专科	民办	民办高校	综合	Xuchang Vocational College Of Ceramic		http://www.xccvc.com	
1	河南省	4141014302	郑州理工职业学院	河南省教育厅	郑州市	专科	民办	民办高校	理工	Zhengzhou Institute Of Technology		http://www.zzlgxy.net	
1	河南省	4141014303	郑州信息工程职业学院	河南省教育厅	郑州市	专科	民办	民办高校	理工	Zhengzhou Information Engineering Vocational College		http://www.zxxyedu.com/	
1	河南省	4141014305	长垣烹饪职业技术学院	河南省教育厅	新乡市	专科	民办	民办高校	理工	Changyuan Pengren Zhiye Jishu Xueyuan		http://www.cyprxy.net/	
1	河南省	4141014306	开封文化艺术职业学院	河南省	开封市	专科		地方公办	文艺	Kaifeng Vocational College Of Culture And Arts		http://www.kfvcca.com/	
1	河南省	4141014307	河南应用技术职业学院	河南省	郑州市	专科		地方公办	理工	Henan Vocational College Of Applied Technology		http://www.hati.edu.cn/	
1	河南省	4141014308	河南艺术职业学院	河南省	郑州市	专科		地方公办	文艺	Henan Vocational Institute Of Arts		http://www.hnyszyxy.net/	
1	河南省	4141014333	郑州升达经贸管理学院	河南省教育厅	郑州市	本科	民办	民办高校	财经	Zhengzhou Shengda University		http://www.shengda.edu.cn/	
1	河南省	4141014348	河南机电职业学院	河南省	郑州市	专科		地方公办	理工	Henan Mechanical And Electrical Vocational College		http://www.hnjd.edu.cn/	
1	河南省	4141014349	河南护理职业学院	河南省	安阳市	专科		地方公办	医药	Henan Vocational College Of Nursing		http://www.hncedu.cn/	
1	河南省	4141014350	许昌电气职业学院	河南省	许昌市	专科		地方公办	理工	Xuchang Electric Vocational College		http://www.xcevc.cn/	
1	河南省	4141014351	信阳涉外职业技术学院	河南省教育厅	信阳市	专科	民办	民办高校	综合	Xinyang International Vocation Institute		http://www.xyswxy.com	
1	河南省	4141014352	鹤壁汽车工程职业学院	河南省教育厅	鹤壁市	专科	民办	民办高校	理工	Hebi Automobile Engineering Professional College		http://www.hbqcxy.com	
1	河南省	4141014353	南阳职业学院	河南省教育厅	南阳市	专科	民办	民办高校	综合	Nanyang Vocational College		http://www.nyzyxy.com	
1	河南省	4141014380	郑州商贸旅游职业学院	河南省教育厅	郑州市	专科	民办	民办高校	综合	Zhengzhou Vocational College Of Commerce&Tourism		http://www.zzvcct.com/	
1	河南省	4141014382	河南推拿职业学院	河南省	洛阳市	专科		地方公办	医药	Henan Vocational College Of Tuina		http://www.hnzjschool.com	
1	河南省	4141014383	洛阳职业技术学院	河南省	洛阳市	专科		地方公办	综合	Luoyang Polytechnic		http://www.lyvtc.net	
1	河南省	4141014391	郑州幼儿师范高等专科学校	河南省	郑州市	专科		地方公办	师范	Zhengzhou Preschool Education College		http://www.zyedu.org	
1	河南省	4141014392	安阳幼儿师范高等专科学校	河南省	安阳市	专科		地方公办	师范	Anyang Preschool Education College		http://www.ayys.net.cn	
1	河南省	4141014405	郑州黄河护理职业学院	河南省教育厅	郑州市	专科	民办	民办高校	医药	Zhengzhou Yellow River Nursing Vocational College		http://www.zyrnvc.com/	
1	河南省	4141014466	河南医学高等专科学校	河南省	郑州市	专科		地方公办	医药	Henan Medical College		http://www.hamc.edu.cn/	
1	河南省	4141014478	郑州财税金融职业学院	河南省	郑州市	专科		地方公办	财经	Zhengzhou Vocational College Of Finance And Taxation		http://www.zzcsjr.edu.cn/	
1	河南省	4141014479	南阳农业职业学院	河南省	南阳市	专科		地方公办	农林	Nanyang Vocational College Of Agriculture		http://www.nyca.edu.cn/	
1	河南省	4141014480	洛阳科技职业学院	河南省教育厅	洛阳市	专科	民办	民办高校	理工	Luoyang Vocational College Of Science And Technology		http://www.lykjxy.cn/	
1	河南省	4141014529	鹤壁能源化工职业学院	河南省教育厅	鹤壁市	专科	民办	民办高校	理工	Hebi Vocational College Of Energy And Chemistry		http://www.hbnyhgzyxy.com/	
1	河南省	4141014530	平顶山文化艺术职业学院	河南省教育厅	平顶山市	专科	民办	民办高校	文艺	Pingdanshan Vocational College of Culture & Art			
1	河南省	4141014597	濮阳医学高等专科学校	河南省	濮阳市	专科		地方公办	医药	Puyang Medicai College		http://www.pymc.edu.cn/	
1	河南省	4141014598	驻马店幼儿师范高等专科学校	河南省	驻马店市	专科		地方公办	师范	Zhumadian Preschool Education College		http://www.zyz.edu.cn/	
1	河南省	4141014606	三门峡社会管理职业学院	河南省	三门峡市	专科		地方公办	财经	Sanmenxia Vocational College Of Social Management		http://www.smxcsa.edu.cn/	
1	河南省	4141014607	河南轻工职业学院	河南省	郑州市	专科		地方公办	理工	Henan Light Industry Vocational College		http://www.henlivtc.com/	
1	河南省	4141014608	河南测绘职业学院	河南省	郑州市	专科		地方公办	理工	Henan College Of Surveying And Mapping		https://www.hasm.edu.cn/	
1	河南省	4141014634	信阳航空职业学院	河南省教育厅	信阳市	专科	民办	民办高校	综合	Xinyang Aviation Vocational College		http://www.xyhkxy.com/	学校名称：2017->2019年 新增“信阳航空职业学院”
1	河南省	4141014635	郑州卫生健康职业学院	河南省	郑州市	专科		地方公办	医药	Zhengzhou Health Vocational College		http://www.zzhvc.com/	学校名称：2017->2019年 新增“郑州卫生健康职业学院”
1	河南省	4141014636	河南物流职业学院	河南省	新乡市	专科		地方公办	理工	Henan Logistics Vocational College		http://www.hnwlxy.edu.cn/	学校名称：2017->2019年 新增“河南物流职业学院”
1	河南省	4141014637	河南地矿职业学院	河南省	郑州市	专科		地方公办	理工	Henan Geology Mineral College		http://www.hagmc.edu.cn/	学校名称：2017->2019年 新增“河南地矿职业学院”
1	河南省	4141014654	郑州西亚斯学院	河南省教育厅	郑州市	本科	民办	民办高校	综合	Sias University		http://www.sias.edu.cn/	学校名称：2017->2019年 新增“郑州西亚斯学院”
1	河南省	4141014685	郑州亚欧交通职业学院	河南省教育厅	郑州市	专科	中外合作办学及内地与港澳合作办学	中外合作	理工	Zhengzhou Eurasia Jiaotong Vocational College		http://www.zzyaou.edu.cn/	学校名称：2017->2019年 新增“郑州亚欧交通职业学院”（河南省）；主管部门：2019->2020年 “河南省”更改为“河南省教育厅”
1	河南省	4141014711	河南女子职业学院	河南省	新乡市	专科		地方公办	师范	Henan Women'S Vocational College		http://www.henz.edu.cn/	学校名称：2019->2020年 新增“河南女子职业学院”
1	河南省	4141014712	河南对外经济贸易职业学院	河南省	开封市	专科		地方公办	财经	Henan Institute Of Foreign Economic Relations And Trade		http://www.hnwmxy.edu.cn/	学校名称：2019->2020年 新增“河南对外经济贸易职业学院”
1	河南省	4141014713	濮阳石油化工职业技术学院	河南省	濮阳市	专科		地方公办	理工	Puyang Petrochemical Vocational And Technical College		http://www.pypcc.cn/	学校名称：2019->2020年 新增“濮阳石油化工职业技术学院”
1	河南省	4141014714	南阳科技职业学院	河南省	南阳市	专科		地方公办	理工	Nanyang Vocational College Of Science And Technology		http://www.nykjzyxydz.com/	学校名称：2019->2020年 新增“南阳科技职业学院”
1	河南省	4141014715	兰考三农职业学院	河南省	开封市	专科		地方公办	综合	Lankao Vocational College Of San Nong		http://www.lksnzyxy.cn/	学校名称：2019->2020年 新增“兰考三农职业学院”
1	河南省	4141014716	汝州职业技术学院	河南省	平顶山市	专科		地方公办	综合	Ruzhou Vocational And Technical College		http://www.rzvtc.cn/	学校名称：2019->2020年 新增“汝州职业技术学院”
1	河南省	4141014717	林州建筑职业技术学院	河南省教育厅	安阳市	专科	民办	民办高校	理工	Linzhou College Of Architectural Technology		http://www.lcat.edu.cn/	学校名称：2019->2020年 新增“林州建筑职业技术学院”
1	河南省	4141014718	郑州电子商务职业学院	河南省教育厅	郑州市	专科	民办	民办高校	综合	Zhengzhou E- Commerce Vocational College		http://www.zzdsxy.cn	学校名称：2019->2020年 新增“郑州电子商务职业学院”
1	河南省	4141014719	郑州轨道工程职业学院	河南省教育厅	郑州市	专科	民办	民办高校	理工	Zhengzhou University Of Railway Engineering		http://www.zzure.edu.cn/	学校名称：2019->2020年 新增“郑州轨道工程职业学院”
1	河南省	4141014720	郑州体育职业学院	河南省教育厅	郑州市	专科	民办	民办高校	体育	Zhengzhou Physical Education Vocational College		http://www.zhengzhoutiyuan.com/	学校名称：2019->2020年 新增“郑州体育职业学院”
1	河南省	4141014750	洛阳文化旅游职业学院	河南省	洛阳市	专科		地方公办	综合	Luoyang Vocational College Of Culture And Tourism		http://lyvcct.cn/	学校名称：2020->2021年 新增“洛阳文化旅游职业学院”
1	河南省	4141014751	周口文理职业学院	河南省	周口市	专科		地方公办	综合	Zhoukou Vocational College Of Arts And Science		http://www.zkwl.edu.cn/	学校名称：2020->2021年 新增“周口文理职业学院”
1	河南省	4141014752	信阳艺术职业学院	河南省	信阳市	专科		地方公办	文艺	Xinyang Vocational College Of Art		http://www.xyyzyedu.cn/	学校名称：2020->2021年 新增“信阳艺术职业学院”
1	河南省	4141014753	郑州城建职业学院	河南省教育厅	郑州市	专科	民办	民办高校	理工	Zhengzhou Urban Construction Vocational College		https://www.zzucvc.edu.cn/	学校名称：2020->2021年 新增“郑州城建职业学院”
1	河南省	4141014754	郑州医药健康职业学院	河南省教育厅	郑州市	专科	民办	民办高校	医药	Zhengzhou Medicine College		http://www.zzyyedu.com	学校名称：2020->2021年 新增“郑州医药健康职业学院”
1	河南省	4141014789	南阳工艺美术职业学院	河南省	南阳市	专科		地方公办	文艺	Nanyang Arts and Crafts Vocational College		http://www.nygymy.com/	学校名称：2022->2023年 新增“南阳工艺美术职业学院”
1	河南省	4141014790	濮阳科技职业学院	河南省	濮阳市	专科		地方公办	理工	Puyang Vocational College of Science and Technology		http://www.pykjzyxy.com/	学校名称：2022->2023年 新增“濮阳科技职业学院”
1	河南省	4141014791	商丘幼儿师范高等专科学校	河南省	商丘市	专科		地方公办	师范	Shangqiu Preschool Education College			学校名称：2022->2023年 新增“商丘幼儿师范高等专科学校”
1	河南省	4141014792	周口理工职业学院	河南省	周口市	专科		地方公办	综合	Zhoukou Polytechnic Vocational College		http://www.zkpvc.edu.cn/	学校名称：2022->2023年 新增“周口理工职业学院”
1	河南省	4141014793	焦作新材料职业学院	河南省教育厅	焦作市	专科	民办	民办高校	理工	Jiaozuo Vocational College of New Materials			学校名称：2022->2023年 新增“焦作新材料职业学院”
1	河南省	4141014794	开封职业学院	河南省教育厅	开封市	专科	民办	民办高校	综合	Kaifeng Vocational College		http://www.kfvc.edu.cn/	学校名称：2022->2023年 新增“开封职业学院”
1	河南省	4141014795	洛阳商业职业学院	河南省教育厅	洛阳市	专科	民办	民办高校	财经	Luoyang Vocational College of Commerce			学校名称：2022->2023年 新增“洛阳商业职业学院”
1	河南省	4141014796	郑州软件职业技术学院	河南省教育厅	郑州市	专科	民办	民办高校	理工	Zhengzhou Software Vocational and Technical College		http://www.zzsvtc.edu.cn/	学校名称：2022->2023年 新增“郑州软件职业技术学院”
1	河南省	4141014797	郑州智能科技职业学院	河南省教育厅	郑州市	专科	民办	民办高校	理工	Zhengzhou Vocational College of Intelligent Technology		http://www.zzcit.edu.cn/	学校名称：2022->2023年 新增“郑州智能科技职业学院”
1	河南省	4141014812	郑州食品工程职业学院	河南省教育厅	郑州市	专科	民办	民办高校	综合	Zhengzhou Institute of Food Technology			学校名称：2022->2023年 新增“郑州食品工程职业学院”
1	河南省	4141014813	郑州汽车工程职业学院	河南省教育厅	郑州市	专科	民办	民办高校	理工	Zhengzhou Vocational College of Automobile Engineering		https://www.zzvcae.edu.cn	学校名称：2022->2023年 新增“郑州汽车工程职业学院”
1	河南省	4141014831	郑州美术学院	河南省教育厅	郑州市	本科	民办	民办高校	艺术	Zhengzhou Academy of Fine Arts		http://www.estedu.com	学校名称：2022->2023年 新增“郑州美术学院”
1	河南省	4141014861	驻马店农业工程职业学院	河南省	驻马店市	专科		地方公办	农林	Zhumadian Agricultural Engineering Vocational College			学校名称：2023->2024年 新增“驻马店农业工程职业学院”
1	河南省	4141014862	信阳科技职业学院	河南省教育厅	信阳市	专科	民办	民办高校	综合	Xinyang Vocational College of Science and Technology			学校名称：2023->2024年 新增“信阳科技职业学院”
1	河南省	4141014863	信阳工程职业学院	河南省教育厅	信阳市	专科	民办	民办高校	理工	Xinyang Engineering Vocational College			学校名称：2023->2024年 新增“信阳工程职业学院”
1	河南省	4141014864	周口城市职业学院	河南省教育厅	周口市	专科	民办	民办高校	综合	Zhoukou City Vocational College			学校名称：2023->2024年 新增“周口城市职业学院”
1	河南省	4141014865	河南新乡工商职业学院	河南省教育厅	新乡市	专科	民办	民办高校	财经	Henan Xinxiang Vocational College of Industry and Commerce			学校名称：2023->2024年 新增“河南新乡工商职业学院”
1	河南省	4141014879	河南体育学院	河南省	郑州市	本科		地方公办	体育	Henan Sport University			学校名称：2023->2024年 新增“河南体育学院”
1	河南省	4241050709	平顶山职业技术学院	河南省	平顶山市	专科		地方公办	综合	Pingdingshan Vocational And Technical College		http://www.pdszy.edu.cn/	学校名称：2017->2019年 新增“平顶山职业技术学院”
1	湖北省	4142010486	武汉大学	教育部	武汉市	本科		教育部直属	综合	Wuhan University	211，985，双一流	https://www.whu.edu.cn/	
1	湖北省	4142010487	华中科技大学	教育部	武汉市	本科		教育部直属	综合	Huazhong University of Science and Technology	211，985，双一流	https://www.hust.edu.cn/	
1	湖北省	4142010488	武汉科技大学	湖北省	武汉市	本科		地方公办	理工	Wuhan University of Science and Technology		http://www.wust.edu.cn/	
1	湖北省	4142010489	长江大学	湖北省	荆州市	本科		地方公办	综合	Yangtze University		http://www.yangtzeu.edu.cn/	
1	湖北省	4142010490	武汉工程大学	湖北省	武汉市	本科		地方公办	理工	Wuhan Institute of Technology		http://www.wit.edu.cn/	
1	湖北省	4142010491	中国地质大学（武汉）	教育部	武汉市	本科		教育部直属	理工	China University of Geosciences	211，双一流	https://www.cug.edu.cn/	
1	湖北省	4142010495	武汉纺织大学	湖北省	武汉市	本科		地方公办	理工	Wuhan Textile University		http://www.wtu.edu.cn/	
1	湖北省	4142010496	武汉轻工大学	湖北省	武汉市	本科		地方公办	理工	Wuhan Polytechnic University		http://www.whpu.edu.cn/	
1	湖北省	4142010497	武汉理工大学	教育部	武汉市	本科		教育部直属	理工	Wuhan University of Technology	211，双一流	https://www.whut.edu.cn/	
1	湖北省	4142010500	湖北工业大学	湖北省	武汉市	本科		地方公办	理工	Hubei University of Technology		https://www.hbut.edu.cn/	
1	湖北省	4142010504	华中农业大学	教育部	武汉市	本科		教育部直属	农业	Huazhong Agricultural University	211，双一流	https://www.hzau.edu.cn/	
1	湖北省	4142010507	湖北中医药大学	湖北省	武汉市	本科		地方公办	医药	Hubei University of Chinese Medicine		https://www.hbucm.edu.cn/	
1	湖北省	4142010511	华中师范大学	教育部	武汉市	本科		教育部直属	师范	Central China Normal University	211，双一流	https://www.ccnu.edu.cn/	
1	湖北省	4142010512	湖北大学	湖北省	武汉市	本科		地方公办	综合	Hubei University		https://hubu.edu.cn/	
1	湖北省	4142010513	湖北师范大学	湖北省	黄石市	本科		地方公办	师范	Hubei Normal University		https://www.hbnu.edu.cn/	
1	湖北省	4142010514	黄冈师范学院	湖北省	黄冈市	本科		地方公办	师范	Huanggang Normal University		https://www.hgnu.edu.cn/	
1	湖北省	4142010517	湖北民族大学	湖北省	恩施土家族苗族自治州	本科		地方公办	民族	Hubei Minzu University		https://www.hbmzu.edu.cn/	学校名称：2017->2019年 “湖北民族学院”更名为“湖北民族大学”
1	湖北省	4142010518	汉江师范学院	湖北省	十堰市	本科		地方公办	师范	Hanjiang Normal University		http://www.hjnu.edu.cn/	
1	湖北省	4142010519	湖北文理学院	湖北省	襄阳市	本科		地方公办	综合	Hubei University of Arts and Science		http://www.hbuas.edu.cn/	
1	湖北省	4142010520	中南财经政法大学	教育部	武汉市	本科		教育部直属	财经	Zhongnan University of Economics and Law	211，双一流	https://www.zuel.edu.cn	
1	湖北省	4142010522	武汉体育学院	湖北省	武汉市	本科		地方公办	体育	Wuhan Sports University		https://www.whsu.edu.cn/	
1	湖北省	4142010523	湖北美术学院	湖北省	武汉市	本科		地方公办	艺术	Hubei Institute of Fine Arts		https://www.hifa.edu.cn/	
1	湖北省	4142010524	中南民族大学	国家民委	武汉市	本科		中央部属	民族	South-Central Minzu University		http://www.scuec.edu.cn/	
1	湖北省	4142010525	湖北汽车工业学院	湖北省	十堰市	本科		地方公办	理工	Hubei University of Automotive Technology		http://www.huat.edu.cn/	
1	湖北省	4142010528	湖北工程学院	湖北省	孝感市	本科		地方公办	综合	Hubei Engineering University		http://www.hbeu.cn	
1	湖北省	4142010834	武汉职业技术学院	湖北省	武汉市	专科		地方公办	理工	Wuhan Polytechnic		http://zjc.wtc.edu.cn/	
1	湖北省	4142010920	湖北理工学院	湖北省	黄石市	本科		地方公办	理工	Hubei Polytechnic University		https://www.hbpu.edu.cn/	
1	湖北省	4142010927	湖北科技学院	湖北省	咸宁市	本科		地方公办	综合	Hubei University of Science and Technology		http://www.hbust.com.cn/	
1	湖北省	4142010929	湖北医药学院	湖北省	十堰市	本科		地方公办	医药	Hubei University of Medicine		http://cx.hbmu.edu.cn/	
1	湖北省	4142010955	黄冈职业技术学院	湖北省	黄冈市	专科		地方公办	理工	Huanggang Polytechnic College		http://www.hbhgzy.com.cn	
1	湖北省	4142010956	长江职业学院	湖北省	武汉市	专科		地方公办	理工	Changjiang Polytechnic		http://www.cjxy.edu.cn/	
1	湖北省	4142011072	江汉大学	湖北省	武汉市	本科		地方公办	综合	Jianghan University		http://www.jhun.edu.cn/	
1	湖北省	4142011074	荆州理工职业学院	湖北省	荆州市	专科		地方公办	理工	Jingzhou Vocational College Of Technology		http://www.jzlg.cn/	
1	湖北省	4142011075	三峡大学	湖北省	宜昌市	本科		地方公办	综合	China Three Gorges University		https://www.ctgu.edu.cn/	
1	湖北省	4142011332	湖北警官学院	湖北省	武汉市	本科		地方公办	政法	Hubei University of Police		http://www.hbpa.edu.cn/	
1	湖北省	4142011334	湖北工业职业技术学院	湖北省	十堰市	专科		地方公办	理工	Hubei Industrial Polytechnic		http://www.hbgyzy.edu.cn/	
1	湖北省	4142011335	鄂州职业大学	湖北省	鄂州市	专科		地方公办	综合	Ezhou Polytechnic		http://www.ezu.net.cn	
1	湖北省	4142011336	荆楚理工学院	湖北省	荆门市	本科		地方公办	理工	Jingchu University of Technology		http://www.jcut.edu.cn/	
1	湖北省	4142011524	武汉音乐学院	湖北省	武汉市	本科		地方公办	艺术	Wuhan conservatory of Music		http://www.whcm.edu.cn/	
1	湖北省	4142011600	湖北经济学院	湖北省	武汉市	本科		地方公办	财经	Hubei University Of Economics		http://www.hbue.edu.cn/	
1	湖北省	4142011654	武汉商学院	湖北省	武汉市	本科		地方公办	财经	Wuhan Business University		http://www.wbu.edu.cn/	
1	湖北省	4142011796	武汉城市职业学院	湖北省	武汉市	专科		地方公办	综合	Wuhan City Polytechnic		http://www.whcvc.edu.cn/	
1	湖北省	4142011798	武汉东湖学院	湖北省教育厅	武汉市	本科	民办	民办高校	理工	Wuhan Donghu University		http://www.wdu.edu.cn/	
1	湖北省	4142011800	汉口学院	湖北省教育厅	武汉市	本科	民办	民办高校	理工	Hankou University		http://www.hkxy.edu.cn/	
1	湖北省	4142012051	湖北职业技术学院	湖北省	孝感市	专科		地方公办	综合	Hubei Polytechnic Institute		http://www.hbvtc.edu.cn/	
1	湖北省	4142012052	武汉船舶职业技术学院	湖北省	武汉市	专科		地方公办	理工	Wuhan Institute Of Shipbuilding Technology		http://www.wspc.edu.cn/	
1	湖北省	4142012309	武昌首义学院	湖北省教育厅	武汉市	本科	民办	民办高校	理工	Wuchang Shouyi University		http://www.hustwb.edu.cn/	
1	湖北省	4142012310	武昌理工学院	湖北省教育厅	武汉市	本科	民办	民办高校	理工	Wuchang University of Technology		http://www.wut.edu.cn/	
1	湖北省	4142012347	恩施职业技术学院	湖北省	恩施土家族苗族自治州	专科		地方公办	综合	Enshi Polytechnic		http://www.eszy.edu.cn/	
1	湖北省	4142012354	襄阳职业技术学院	湖北省	襄阳市	专科		地方公办	综合	Xiangyang Vocational And Technical College		http://www.hbxftc.com	
1	湖北省	4142012362	武汉生物工程学院	湖北省教育厅	武汉市	本科	民办	民办高校	理工	Wuhan Institute of Bioengineering		http://www.whsw.net	
1	湖北省	4142012369	武汉工贸职业学院	湖北省教育厅	武汉市	专科	民办	民办高校	综合	Wuhan Vocational College Of Industry And Trade		http://www.whgmxy.edu.cn/	
1	湖北省	4142012737	荆州职业技术学院	湖北省	荆州市	专科		地方公办	理工	Jingzhou Institute Of Technology		http://www.jzit.net.cn/test/	
1	湖北省	4142012738	武汉工程职业技术学院	湖北省	武汉市	专科		地方公办	理工	Wuhan Engineering Institute		http://www.wgxy.net	
1	湖北省	4142012740	仙桃职业学院	湖北省	仙桃市	专科		地方公办	理工	Xiantao Vocational College		http://www.hbxtzy.com	
1	湖北省	4142012744	湖北轻工职业技术学院	湖北省	武汉市	专科		地方公办	理工	Hubei Light Industry Technology Institute		http://www.hbliti.com	
1	湖北省	4142012752	湖北交通职业技术学院	湖北省	武汉市	专科		地方公办	理工	Hubei Communications Technical College		http://www.hbctc.edu.cn/	
