状态	地区	学校标识码	学校名称	主管部门	所在地	办学层次	备注	adminType	categoryName	英文名称	双一流建设	官网链接	更新说明
1	江苏省	4132013983	苏州城市学院	江苏省	苏州市	本科		地方公办	综合			http://www.szcu.edu.cn/	学校名称：2020->2021年 “苏州大学文正学院”更名为“苏州城市学院”；主管部门：2020->2021年 “江苏省教育厅”更改为“江苏省”；备注：2020->2021年 “民办”更改为“公办”
1	江苏省	4132013984	苏州大学应用技术学院	江苏省教育厅	苏州市	本科	民办	独立学院	综合	Applied Technology College of Soochow University		http://tec.suda.edu.cn/	
1	江苏省	4132013985	苏州科技大学天平学院	江苏省教育厅	苏州市	本科	民办	独立学院	综合	Tianping College of Suzhou University of Science and Technology		http://tpxy.usts.edu.cn/	
1	江苏省	4132013986	江苏大学京江学院	江苏省教育厅	镇江市	本科	民办	独立学院	综合	Jiangsu University Jingjiang College		http://jjxy.ujs.edu.cn/	
1	江苏省	4132013987	扬州大学广陵学院	江苏省教育厅	扬州市	本科	民办	独立学院	综合	Guangling College of Yangzhou University		http://glxy.yzu.edu.cn/	
1	江苏省	4132013988	江苏师范大学科文学院	江苏省教育厅	徐州市	本科	民办	独立学院	综合	Jiangsu Normal University Kewen College		http://kwxy.jsnu.edu.cn/	
1	江苏省	4132013989	南京邮电大学通达学院	江苏省教育厅	扬州市	本科	民办	独立学院	综合	Tongda College of Nanjing University of Posts and Telecommunications		http://www.tdxy.com.cn	
1	江苏省	4132013990	南京财经大学红山学院	江苏省教育厅	镇江市	本科	民办	独立学院	综合	Nanjing University of Finance and Economics Hongshan College		http://hs.njue.edu.cn/	
1	江苏省	4132013991	江苏科技大学苏州理工学院	江苏省教育厅	苏州市	本科	民办	独立学院	综合	Suzhou Institute of Technology, Jiangsu University of Science and Technology		http://szlg.just.edu.cn/	
1	江苏省	4132013992	常州大学怀德学院	江苏省教育厅	泰州市	本科	民办	独立学院	综合	Changzhou University Huaide College		http://hdc.cczu.edu.cn/	
1	江苏省	4132013993	南通大学杏林学院	江苏省教育厅	南通市	本科	民办	独立学院	综合	Nantong University Xinglin College		http://xlxy.ntu.edu.cn/	
1	江苏省	4132013994	南京审计大学金审学院	江苏省教育厅	南京市	本科	民办	独立学院	综合	Nanjing Audit University Jinshen College		http://www.naujsc.edu.cn/	
1	江苏省	4132014000	江苏城市职业学院	江苏省	南京市	专科		地方公办	理工	The City Vocational College Of Jiangsu		http://www.jscvc.cn/main.htm	
1	江苏省	4132014001	南京城市职业学院	江苏省	南京市	专科		地方公办	综合	Nanjing City Vocational College		http://www.ncc.com.cn/	
1	江苏省	4132014056	南京机电职业技术学院	江苏省	南京市	专科		地方公办	理工	Nanjing Vocational Institute Of Mechatronic Technology			
1	江苏省	4132014160	宿迁学院	江苏省	宿迁市	本科		地方公办	综合	Suqian College		https://www.squ.edu.cn/	
1	江苏省	4132014163	苏州高博职业学院	江苏省教育厅	苏州市	专科	民办	民办高校	理工	Global Institute Of Software Technology			学校名称：2023->2024年 “苏州高博软件技术职业学院”更名为“苏州高博职业学院”
1	江苏省	4132014180	南京旅游职业学院	江苏省	南京市	专科		地方公办	财经	Nanjing Institute Of Tourism & Hospitality		http://www.jltu.net/	
1	江苏省	4132014255	江苏卫生健康职业学院	江苏省	南京市	专科		地方公办	医药	Jiangsu Health Vocational College		http://www.jssmu.edu.cn/	
1	江苏省	4132014256	苏州信息职业技术学院	江苏省	苏州市	专科		地方公办	理工	Suzhou College Of Information Technology		http://www.szitu.cn/	
1	江苏省	4132014293	宿迁泽达职业技术学院	江苏省教育厅	宿迁市	专科	民办	民办高校	理工	Suqian Zeda Vocational&Technical College		http://www.zdct.cn	
1	江苏省	4132014295	苏州工业园区服务外包职业学院	江苏省	苏州市	专科		地方公办	理工	Suzhou Industrial Park Institute Of Service Outsourcing		http://www.sipiso.com.cn/	
1	江苏省	4132014329	徐州幼儿师范高等专科学校	江苏省	徐州市	专科		地方公办	师范	Xuzhou Kindergarten Teachers College		http://www.xzyz.edu.cn/	
1	江苏省	4132014401	徐州生物工程职业技术学院	江苏省	徐州市	专科		地方公办	理工	Xuzhou Vocational College Of Bioengineering		http://www.xzsw.net/	
1	江苏省	4132014436	江苏第二师范学院	江苏省	南京市	本科		地方公办	师范	Jiangsu Second Normal University		https://www.jssnu.edu.cn/	
1	江苏省	4132014475	江苏商贸职业学院	江苏省	南通市	专科		地方公办	财经	Jiangsu Vocational College Of Business		http://www.jsbc.edu.cn/	
1	江苏省	4132014493	南通师范高等专科学校	江苏省	南通市	专科		地方公办	师范	Nantong Normal College		http://www.ntnc.edu.cn/	
1	江苏省	4132014528	扬州中瑞酒店职业学院	江苏省教育厅	扬州市	专科	民办	民办高校	财经	Yangzhou Hospitality Institute		http://www.yhiedu.cn/	
1	江苏省	4132014541	江苏护理职业学院	江苏省	淮安市	专科		地方公办	医药	Jiangsu Collge Of Nursing		http://www.jscn.edu.cn/	
1	江苏省	4132014542	江苏财会职业学院	江苏省	连云港市	专科		地方公办	财经	Jiangsu College Of Finance & Accounting		-	
1	江苏省	4132014543	江苏城乡建设职业学院	江苏省	常州市	专科		地方公办	理工	Jiangsu Urban And Rural Construction College		http://www.jscc.edu.cn/	
1	江苏省	4132014568	江苏航空职业技术学院	江苏省	镇江市	专科		地方公办	理工	Jiangsu Aviation Technical College		http://www.jatc.edu.cn/	
1	江苏省	4132014589	江苏安全技术职业学院	江苏省	徐州市	专科		地方公办	理工	Jiangsu College Of Safety Technology		http://www.jscst.edu.cn/	
1	江苏省	4132014604	江苏旅游职业学院	江苏省	扬州市	专科		地方公办	财经	Jiangsu Vocational College Of Tourism		http://www.jstc.edu.cn/	
1	江苏省	4132014773	常州幼儿师范高等专科学校	江苏省	常州市	专科		地方公办	师范	Changzhou Early Childhood Education College		http://www.wjtts.net	学校名称：2021->2022年 新增“常州幼儿师范高等专科学校”
1	江苏省	4132014841	江苏司法警官职业学院	江苏省	南京市	专科		地方公办	政法	Jiangsu Judicial Police Officer Vocational College			学校名称：2023->2024年 新增“江苏司法警官职业学院”
1	江苏省	4132014853	盐城农业科技职业学院	江苏省	盐城市	专科		地方公办	农林	Yancheng Agricultural College			学校名称：2023->2024年 新增“盐城农业科技职业学院”
1	江苏省	4132014854	宿迁幼儿师范高等专科学校	江苏省	宿迁市	专科		地方公办	师范	Suqian Preschool Teachers College			学校名称：2023->2024年 新增“宿迁幼儿师范高等专科学校”
1	江苏省	4132014855	无锡师范高等专科学校	江苏省	无锡市	专科		地方公办	师范	Wuxi Normal College			学校名称：2023->2024年 新增“无锡师范高等专科学校”
1	江苏省	4132016403	西交利物浦大学	江苏省教育厅	苏州市	本科	中外合作办学及内地与港澳合作办学	中外合作	综合	Xi'an Jiaotong-Liverpool University		http://www.xjtlu.edu.cn/	
1	江苏省	4132016406	昆山杜克大学	江苏省教育厅	昆山市	本科	中外合作办学及内地与港澳合作办学	中外合作	综合	Duke Kunshan University		https://www.dukekunshan.edu.cn/	
1	浙江省	4133010335	浙江大学	教育部	杭州市	本科		教育部直属	综合	Zhejiang University	211，985，双一流	https://www.zju.edu.cn/	
1	浙江省	4133010336	杭州电子科技大学	浙江省	杭州市	本科		地方公办	理工	Hangzhou Dianzi University		https://www.hdu.edu.cn/	
1	浙江省	4133010337	浙江工业大学	浙江省	杭州市	本科		地方公办	理工	Zhejiang University of Technology		https://www.zjut.edu.cn/	
1	浙江省	4133010338	浙江理工大学	浙江省	杭州市	本科		地方公办	理工	Zhejiang Sci-Tech University		http://www.zstu.edu.cn/	
1	浙江省	4133010340	浙江海洋大学	浙江省	舟山市	本科		地方公办	农业	Zhejiang Ocean University		http://www.zjou.net.cn/	
1	浙江省	4133010341	浙江农林大学	浙江省	杭州市	本科		地方公办	林业	Zhejiang A&F University		https://www.zstu.edu.cn/	
1	浙江省	4133010343	温州医科大学	浙江省	温州市	本科		地方公办	医药	Wenzhou Medical University		https://www.wmu.edu.cn/	
1	浙江省	4133010344	浙江中医药大学	浙江省	杭州市	本科		地方公办	医药	Zhejiang Chinese Medical University		http://www.zjtcm.net/default.html	
1	浙江省	4133010345	浙江师范大学	浙江省	金华市	本科		地方公办	师范	Zhejiang Normal University		http://www.zjnu.edu.cn/	
1	浙江省	4133010346	杭州师范大学	浙江省	杭州市	本科		地方公办	师范	Hangzhou Normal University		https://www.hznu.edu.cn/	
1	浙江省	4133010347	湖州师范学院	浙江省	湖州市	本科		地方公办	师范	Huzhou University		http://www.hutc.zj.cn	
1	浙江省	4133010349	绍兴文理学院	浙江省	绍兴市	本科		地方公办	师范	Shaoxing University		http://www.usx.edu.cn/	
1	浙江省	4133010350	台州学院	浙江省	台州市	本科		地方公办	综合	wk		http://www.tzc.edu.cn/	
1	浙江省	4133010351	温州大学	浙江省	温州市	本科		地方公办	综合	Wenzhou University		http://www.wzu.edu.cn/	
1	浙江省	4133010352	丽水学院	浙江省	丽水市	本科		地方公办	师范	Lishui University		http://www.lsu.edu.cn/	
1	浙江省	4133010353	浙江工商大学	浙江省	杭州市	本科		地方公办	财经	Zhejiang Gongshang University		http://www.zjgsu.edu.cn/	
1	浙江省	4133010354	嘉兴大学	浙江省	嘉兴市	本科		地方公办	综合	Jiaxing University		http://www.zjxu.edu.cn/	学校名称：2023->2024年 “嘉兴学院”更名为“嘉兴大学”
1	浙江省	4133010355	中国美术学院	浙江省	杭州市	本科		地方公办	艺术	China Academy of Art	双一流	http://www.caa.edu.cn/	
1	浙江省	4133010356	中国计量大学	浙江省	杭州市	本科		地方公办	理工	China Jiliang University		http://www.cjlu.edu.cn/	
1	浙江省	4133010863	宁波职业技术学院	浙江省	宁波市	专科		地方公办	综合	Ningbo Polytechnic		http://www.nbpt.edu.cn/	
1	浙江省	4133010864	温州职业技术学院	浙江省	温州市	专科		地方公办	综合	Wenzhou Polytechnic		http://www.wzvtc.cn/	
1	浙江省	4133010876	浙江万里学院	浙江省	宁波市	本科		地方公办	理工	Zhejiang Wanli University		http://www.zjwu.net/	
1	浙江省	4133011057	浙江科技大学	浙江省	杭州市	本科		地方公办	理工	Zhejiang University of Science & Technology		http://www.zust.edu.cn/	学校名称：2023->2024年 “浙江科技学院”更名为“浙江科技大学”
1	浙江省	4133011058	宁波工程学院	浙江省	宁波市	本科		地方公办	理工	Ningbo University of Technology		http://www.nbut.cn/	
1	浙江省	4133011481	浙江水利水电学院	浙江省	杭州市	本科		地方公办	理工	Zhejiang University of Water Resources and Electric Power		http://www.zjwchc.com/	
1	浙江省	4133011482	浙江财经大学	浙江省	杭州市	本科		地方公办	财经	Zhejiang University of Finance and Economics		https://www.zufe.edu.cn/	
1	浙江省	4133011483	浙江警察学院	浙江省	杭州市	本科		地方公办	政法	Zhejiang Police College		http://www.zjjcxy.cn	
1	浙江省	4133011488	衢州学院	浙江省	衢州市	本科		地方公办	理工	Quzhou University		http://www.qzu.zj.cn/	
1	浙江省	4133011646	宁波大学	浙江省	宁波市	本科		地方公办	综合	Ningbo University	双一流	https://www.nbu.edu.cn/	
1	浙江省	4133011647	浙江传媒学院	浙江省	杭州市	本科		地方公办	语言	Communication University of Zhejiang		https://www.cuz.edu.cn/	
1	浙江省	4133011842	浙江树人学院	浙江省教育厅	杭州市	本科	民办	民办高校	理工	Zhejiang Shuren University		https://www.zjsru.edu.cn/	
1	浙江省	4133012036	浙江交通职业技术学院	浙江省	杭州市	专科		地方公办	理工	Zhejiang Institute Of Communications		http://www.zjvtit.edu.cn/	
1	浙江省	4133012061	金华职业技术大学	浙江省	金华市	本科		地方公办	综合	Jinhua Polytechnic		http://zsw.jhc.cn/	学校名称：2023->2024年 “金华职业技术学院”更名为“金华职业技术大学”；办学层次：2023->2024年 “专科”更改为“本科”
1	浙江省	4133012645	宁波城市职业技术学院	浙江省	宁波市	专科		地方公办	综合	Ningbo City College Of Vocational Technology		http://www.nbcc.cn/	
1	浙江省	4133012646	浙江电力职业技术学院	浙江省	杭州市	专科		地方公办		Zhejiang Electric Power Vocational And Technical College			
1	浙江省	4133012647	浙江同济科技职业学院	浙江省	杭州市	专科		地方公办	理工	Zhejiang Tongji Vocational College Of Science And Technology		http://www.zjtongji.edu.cn/	
1	浙江省	4133012789	浙江工商职业技术学院	浙江省	宁波市	专科		地方公办	财经	Zhejiang Business Technology Institute		http://www.zjbti.net.cn/	
1	浙江省	4133012790	台州职业技术学院	浙江省	台州市	专科		地方公办	综合	Taizhou Vocational And Technical College		http://www.tzvtc.com/	
1	浙江省	4133012791	浙江工贸职业技术学院	浙江省	温州市	专科		地方公办	综合	Zhejiang Industry & Trade Vocational College		http://www.zjitc.net/	
1	浙江省	4133012792	浙江越秀外国语学院	浙江省教育厅	绍兴市	本科	民办	民办高校	语言	Zhejiang Yuexiu University of Foreign Languages		http://www.zyufl.edu.cn/	
1	浙江省	4133012861	浙江机电职业技术大学	浙江省	杭州市	本科		地方公办	理工	Zhejiang Institute Of Mechanical & Electrical Engineering		http://www.zime.edu.cn/	学校名称：2023->2024年 “浙江机电职业技术学院”更名为“浙江机电职业技术大学”；办学层次：2023->2024年 “专科”更改为“本科”
1	浙江省	4133012862	浙江建设职业技术学院	浙江省	杭州市	专科		地方公办	理工	Zhejiang College Of Construction		http://www.zjjy.net/	
1	浙江省	4133012863	浙江艺术职业学院	浙江省	杭州市	专科		地方公办	文艺	Zhejiang Vocational Academy Of Art		http://www.zj-art.com/	
1	浙江省	4133012864	浙江经贸职业技术学院	浙江省	杭州市	专科		地方公办	财经	Zhejiang Institute Of Economics And Trade		http://www.zjiet.edu.cn/	
1	浙江省	4133012865	浙江商业职业技术学院	浙江省	杭州市	专科		地方公办	财经	Zhejiang Business College		http://www.zjvcc.edu.cn/	
1	浙江省	4133012866	浙江经济职业技术学院	浙江省	杭州市	专科		地方公办	财经	Zhejiang Technical Institute Of Economics		http://www.zjtie.edu.cn/	
1	浙江省	4133012867	浙江旅游职业学院	浙江省	杭州市	专科		地方公办	财经	Tourism College Of Zhejiang China		https://www.tourzj.edu.cn/	
1	浙江省	4133012868	浙江育英职业技术学院	浙江省教育厅	杭州市	专科	民办	民办高校	财经	Zhejiang Yuying College Of Vocational Technology		http://www.zjyyc.com/	
1	浙江省	4133012869	浙江警官职业学院	浙江省	杭州市	专科		地方公办	政法	Zhejiang Police Vocational Academy		http://www.zjjy.com.cn/	
1	浙江省	4133012870	浙江金融职业学院	浙江省	杭州市	专科		地方公办	财经	Zhejiang Financial College		http://www.zfc.edu.cn/	
1	浙江省	4133012871	浙江工业职业技术学院	浙江省	绍兴市	专科		地方公办	综合	Zhejiang Industry Polytechnic College		http://www.zjipc.com/	
1	浙江省	4133012872	杭州职业技术学院	浙江省	杭州市	专科		地方公办	综合	Hangzhou Vocational & Technical College		http://www.hzvtc.edu.cn/	
1	浙江省	4133012874	嘉兴职业技术学院	浙江省	嘉兴市	专科		地方公办	综合	Jiaxing Vocational & Technical College		https://www.jxvtc.edu.cn/	
1	浙江省	4133012875	湖州职业技术学院	浙江省	湖州市	专科		地方公办	综合	Huzhou Vocational & Technical College		http://www.hzvtc.net.cn/	
1	浙江省	4133012876	绍兴职业技术学院	浙江省教育厅	绍兴市	专科	民办	民办高校	理工	Shaoxing Vocational & Technical College		http://www.sxvtc.com/	
1	浙江省	4133012877	衢州职业技术学院	浙江省	衢州市	专科		地方公办	综合	Quzhou College Of Technology		http://www.qzct.net/	
1	浙江省	4133012878	丽水职业技术学院	浙江省	丽水市	专科		地方公办	综合	Lishui Vocational And Technical College		http://www.lszjy.com/	
1	浙江省	4133013001	宁波财经学院	浙江省教育厅	宁波市	本科	民办	民办高校	财经	Ningbo University of Finance & Economics		https://www.nbufe.edu.cn/	学校名称：2017->2019年 “宁波大红鹰学院”更名为“宁波财经学院”
1	浙江省	4133013002	浙江东方职业技术学院	浙江省教育厅	温州市	专科	民办	民办高校	综合	Zhejiang Dongfang Polytechnic		http://www.zjdfc.com/	
1	浙江省	4133013003	义乌工商职业技术学院	浙江省	金华市	专科		地方公办	财经	Yiwu Industrial & Commercial College		http://www.ywu.cn/	
1	浙江省	4133013021	浙大城市学院	浙江省	杭州市	本科		地方公办	理工	Zhejiang University City College		http://www.zucc.edu.cn/	学校名称：2019->2020年 “浙江大学城市学院”更名为“浙大城市学院”；主管部门：2019->2020年 “浙江省教育厅”更改为“浙江省”；备注：2019->2020年 “民办”更改为“公办”
1	浙江省	4133013022	浙大宁波理工学院	浙江省	宁波市	本科		地方公办	理工	NingboTech University		https://www.nbt.edu.cn/	学校名称：2019->2020年 “浙江大学宁波理工学院”更名为“浙大宁波理工学院”；主管部门：2019->2020年 “浙江省教育厅”更改为“浙江省”；备注：2019->2020年 “民办”更改为“公办”
1	浙江省	4133013023	杭州医学院	浙江省	杭州市	本科		地方公办	医药	Hangzhou Medical College		https://www.hmc.edu.cn/	
1	浙江省	4133013025	浙江纺织服装职业技术学院	浙江省	宁波市	专科		地方公办	理工	Zhejiang Fashion Institute Of Technology		http://www.zjff.net/	
1	浙江省	4133013026	杭州科技职业技术学院	浙江省	杭州市	专科		地方公办	理工	Hangzhou Polytechnic		https://www.hzpt.edu.cn/	
1	浙江省	4133013027	浙江长征职业技术学院	浙江省教育厅	杭州市	专科	民办	民办高校	综合	Zhejiang Changzheng Vocational&Technical College		http://www.zjczxy.cn/	
1	浙江省	4133013028	嘉兴南洋职业技术学院	浙江省教育厅	嘉兴市	专科	民办	民办高校	理工	Jiaxing Nanyang Polytechnic Institute		http://www.jxnyc.net/	
1	浙江省	4133013029	浙江广厦建设职业技术大学	浙江省教育厅	金华市	本科	民办	民办高校	理工	Zhejiang Guangsha Vocational and Technical University of construction		http://www.guangshaxy.com/	学校名称：2019->2020年 “浙江广厦建设职业技术学院”更名为“浙江广厦建设职业技术大学”；办学层次：2019->2020年 “专科”更改为“本科”
1	浙江省	4133013030	杭州万向职业技术学院	浙江省教育厅	杭州市	专科	民办	民办高校	综合	Hangzhou Wanxiang Polytechnic		http://www.wxpoly.cn/	
1	浙江省	4133013275	浙江工业大学之江学院	浙江省教育厅	杭州市	本科	民办	独立学院	理工	Zhijiang College of Zhejiang University of Technology		http://zs.zjc.zjut.edu.cn/	
1	浙江省	4133013276	浙江师范大学行知学院	浙江省教育厅	金华市	本科	民办	独立学院	综合	Xingzhi College Zhejiang Normal University		http://xz.zjnu.edu.cn/	
1	浙江省	4133013277	宁波大学科学技术学院	浙江省教育厅	宁波市	本科	民办	独立学院	综合	College of Science and Technology Ningbo University		http://www.ndky.edu.cn/	
1	浙江省	4133013279	杭州电子科技大学信息工程学院	浙江省教育厅	杭州市	本科	民办	独立学院	理工	Hangzhou Dianzi University Information Engineering School		http://zs.hziee.edu.cn/	
1	浙江省	4133013280	浙江理工大学科技与艺术学院	浙江省教育厅	杭州市	本科	民办	独立学院	理工	Keyi College of Zhejiang Sci-Tech University		http://kyzstu.benke.chaoxing.com/	
1	浙江省	4133013283	浙江农林大学暨阳学院	浙江省教育厅	绍兴市	本科	民办	独立学院	林业	Jiyang College of Zhejiang A&F University		http://tmxy.zafu.edu.cn/	
1	浙江省	4133013284	温州医科大学仁济学院	浙江省教育厅	温州市	本科	民办	独立学院	医药	Wenzhou Medical University RenJi College		http://www.wzmc.net	
1	浙江省	4133013285	浙江中医药大学滨江学院	浙江省教育厅	杭州市	本科	民办	独立学院	医药	ZheJiang Chinese Medicine University BinJiang College		http://bjxy.zjtcm.net/	
1	浙江省	4133013286	杭州师范大学钱江学院	浙江省教育厅	杭州市	本科	民办	独立学院	师范	Hangzhou Normal University Qianjiang College		http://qjzs.hznu.edu.cn/	
1	浙江省	4133013287	湖州学院	浙江省	湖州市	本科		地方公办	师范	Huzhou University Qiuzhen College		https://www.zjhzu.edu.cn/	学校名称：2020->2021年 “湖州师范学院求真学院”更名为“湖州学院”；主管部门：2020->2021年 “浙江省教育厅”更改为“浙江省”；备注：2020->2021年 “民办”更改为“公办”
1	浙江省	4133013288	绍兴文理学院元培学院	浙江省教育厅	绍兴市	本科	民办	独立学院	师范	Shaoxing University Yuanpei College		http://ypc.edu.cn/	
1	浙江省	4133013289	温州理工学院	浙江省	温州市	本科		地方公办	理工	Wenzhou University Oujiang College		https://www.wzut.edu.cn/	学校名称：2020->2021年 “温州大学瓯江学院”更名为“温州理工学院”；主管部门：2020->2021年 “浙江省教育厅”更改为“浙江省”；备注：2020->2021年 “民办”更改为“公办”
1	浙江省	4133013290	浙江工商大学杭州商学院	浙江省教育厅	杭州市	本科	民办	独立学院	财经	Zhejiang Gongshang University Hangzhou College of Commerce		http://hsy.zjgsu.edu.cn/	
1	浙江省	4133013291	嘉兴南湖学院	浙江省	嘉兴市	本科		地方公办	财经			https://www.jxnhu.edu.cn/	学校名称：2020->2021年 “嘉兴学院南湖学院”更名为“嘉兴南湖学院”；主管部门：2020->2021年 “浙江省教育厅”更改为“浙江省”；备注：2020->2021年 “民办”更改为“公办”
1	浙江省	4133013292	中国计量大学现代科技学院	浙江省教育厅	杭州市	本科	民办	独立学院	理工	China Jiliang University College of Modern Science and Technology		http://xdkj.cjlu.edu.cn/	
1	浙江省	4133013294	浙江财经大学东方学院	浙江省教育厅	嘉兴市	本科	民办	独立学院	财经	Zhejiang University of Finance and Economics Dongfang College		https://www.zufedfc.edu.cn/	
1	浙江省	4133013637	温州商学院	浙江省教育厅	温州市	本科	民办	民办高校	财经	Wenzhou Business College		http://www.wucc.cn/	
1	浙江省	4133013688	浙江邮电职业技术学院	浙江省	绍兴市	专科		地方公办	理工	Zhejiang Post And Telecommunication College		http://www.zptc.cn/	
1	浙江省	4133013742	宁波卫生职业技术学院	浙江省	宁波市	专科		地方公办	医药	Ningbo College Of Health Sciences		http://www.nbchs.net/	
1	浙江省	4133013746	台州科技职业学院	浙江省	台州市	专科		地方公办	综合	Taizhou Vocational College Of Science & Technology		http://www.tzvcst.net/	
1	浙江省	4133013853	浙江国际海运职业技术学院	浙江省	舟山市	专科		地方公办	理工	Zhejiang International Maritime College		http://www.zimc.cn/	
1	浙江省	4133013854	浙江体育职业技术学院	浙江省	杭州市	专科		地方公办	体育	Zhejiang College Of Sports		http://www.zjcs.net.cn/login.php	
1	浙江省	4133014088	温州科技职业学院	浙江省	温州市	专科		地方公办	农林	Wenzhou Vocational College Of Science And Technology		http://www.wzvcst.cn/	
1	浙江省	4133014089	浙江汽车职业技术学院	浙江省教育厅	台州市	专科	民办	民办高校	理工	Zhejiang Automotive Vocational And Technical College		http://www.geelyedu.com/sy.html	
1	浙江省	4133014090	浙江横店影视职业学院	浙江省教育厅	金华市	专科	民办	民办高校	文艺	Hengdian College Of Film & Television		http://zjhyxy.zhiye.chaoxing.com/	
1	浙江省	4133014206	同济大学浙江学院	浙江省教育厅	嘉兴市	本科	民办	独立学院	综合	TongJi ZheJiang College		http://www.tjzj.edu.cn/	
1	浙江省	4133014207	上海财经大学浙江学院	浙江省教育厅	金华市	本科	民办	独立学院	财经	Shanghai University of Finance and Economics Zhejiang College		http://www.shufe-zj.edu.cn/	
1	浙江省	4133014269	浙江农业商贸职业学院	浙江省	绍兴市	专科		地方公办	财经	Zhejiang Agricultural Business College		http://www.znszy.com/	
1	浙江省	4133014275	浙江外国语学院	浙江省	杭州市	本科		地方公办	语言	Zhejiang International Studies University		https://www.zisu.edu.cn/	
1	浙江省	4133014431	浙江特殊教育职业学院	浙江省	杭州市	专科		地方公办	师范	Zhejiang Vocational College Of Special Education		http://www.zjtjxy.net/	
